title,text,tegs,url
Черкаська художниця-самоучка здивувала грузинського Патріарха та знайшла визнання в Європі," Черкаська художниця Одарка Дьома-Пісна підкорює своїми картинами Європу, а за портрет Патріарха Грузії отримала найвищу оцінку від видатної духовної постаті. Відомий італійський критик Laura Di Trapani внесла роботи українки до свого каталогу, де представлені картини 50 найкращих сучасних художниць світу. Про шанси українських художників за кордоном, самоосвіту та власний творчий шлях талановита уманчанка розповіла сайту vikka.ua.  Фото з архіву героїні публікації Італія, Іспанія та Грузія двічі бачили виставки української художниці. Також роботи уманчанки оцінили у Парижі. Дівчина каже, що з-під її пензля вийшли близько 300 картин. Читайте: Черкащанка розвиває у Канаді новий напрям мистецтва Одарка Дьома-Пісна живе в Умані. Ще з дитинства дівчина поринула у світ пензлів та фарб.   ""Першу картину намалювала в 11 років. Це завдяки дідусю Івану Абрамовичу. Наразі йому 81 рік. Колись він малював, його брати теж художники. Дідусь брав мене малу з собою до парку ""Софіївка"", де створював картини. І мене, зокрема, малював. Але то була творчість для себе. Без спеціальної освіти за радянських часів ти не міг конкурувати з офіційними художниками"", – розповідає уманчанка.  Facebook / Dema-Pisna Odarka Художниця теж не має спеціальної освіти. Вона вивчилася на філолога. Але це не завадило їй у кар’єрі. ""Малювати вчилася самостійно, довго виписувалася, шукала свій стиль. Працюю на межі між імпресіонізмом та постімпресіонізмом. Навчаючись у своїх улюблених художників Ван Гога, Модільяні, Моне, взяла від них техніку.  Але найбільше мені підходить напрям арт-наїв – наївне мистецтво. Воно передає емоції. Це коли ти тільки щось побачив, пережив і одразу втілюєш"", – пояснює Одарка Дьома-Пісна.  Facebook / Dema-Pisna Odarka В Україні черкащанка своїм талантом не заробляє, а здебільшого продає заради благодійності.  Facebook / Dema-Pisna Odarka ""Україні наразі не до живопису. Я постійно проводжу тут виставки. Коли ж продаю в Україні картини, ці кошти йдуть на допомогу дітям з притулків та тим, хто потребує помочі. Продаю картини і за кордоном. За скільки – не скажу (посміхається). Найдорожча вартувала більше 800 євро"", – ділиться Одарка Дьома-Пісна.  Facebook / Dema-Pisna Odarka Серед її картин є особливе полотно – портрет Патріарха всієї Грузії Іллі Другого. Черкащанка каже, що завдяки цьому полотну отримала найціннішу для неї самої характеристику її робіт.   Портрет вона презентувала на виставці в Грузії.  Facebook / Dema-Pisna Odarka  З грузинською співачкою, актрисою театру i кiно Лелукою Телiєю на її Батьківщині. Фото з архіву героїні публікації ""У жовтні цього року я була на прийомі у Патріарха. Влаштувати це було непросто. Я подарувала йому його портрет. Він узяв картину, подивився на неї, переглянув каталог і запитав: а ви справді українка? Я відповіла, що в мені повністю тече українська кров. А він сказав, що в мені дуже відчуваються грузинські почуття. Зазначив, що я здаюся йому напівгрузинкою  –  так точно відчула їхню країну"", – пригадує художниця.  Facebook / Dema-Pisna Odarka Вона каже, що успіх прийшов до неї завдяки родині. Батьки у всьому підтримували, а 4-річна донька Злата – джерело натхнення.  Facebook / Dema-Pisna Odarka ""Якби не підтримка родини – мені нічого б не вдалося. Мій батько для мене найбільший авторитет, і не тому, що він мій батько. Він має дуже велике серце, до того ж усе життя він шукав щось нове. Якось вирішив, що в Умані не вистачає байкерського заходу. Він організував у місті мотофестиваль ""Умань 5 доріг"". Останній зліт налічував 6 тисяч осіб. Крім того, він мисливець, кінолог. У мене творча мама. Вона шиє ляльки та красиві дитячі речі"", – розповідає уманчанка.  Фото з архіву героїні публікації Наразі дівчина готується до нової виставки ""Різдвяна Австрія"". ""Мене називають різдвяним художником, бо велика кількість моїх виставок відбувалася напередодні цього свята. Взагалі Різдво для моєї родини – це щось особливе. У нас є власні традиції, які ми самі вигадуємо та впроваджуємо. Наприклад, перед Новим роком наша родина допомагає дитячим будинкам та тим, хто потребує допомоги. Я перед святом пишу листи-вибачення тим людям, з якими посварилася. Пишу про свої відчуття та вибачаюсь. Після цього з деким у мене навіть складалися дружні стосунки"", – ділиться власним досвідом художниця.  З мамою та донькою / Facebook / Dema-Pisna Odarka Уманчанка каже, що сімейний ген багато в чому унаслідувала її донька. ""У нас проживає двоє собак, які раніше були безпритульними. Ми їх взяли на перетримку, але донька Злата вмовила їх залишити. Це тепер її собаки, але доглядаю їх чомусь я"", – сміється уманчанка.  Фото з архіву героїні публікації Вона радить молодим українським художникам не зволікати і не вважати, що реалізовуватися за кордоном складно. За її словами, наразі талановитих українців охоче сприймає світ.  Фото з архіву героїні публікації ""Раджу колегам стукати у всі двері. Знайдуться моменти, коли одна з них відкриється. Взяти участь у закордонній виставці або влаштувати там свою не так важко, як здається нашим молодим художникам. Декого лякає, що це потягне за собою великі витрати. Насправді кошти знадобляться тільки на проїзд та проживання. А можна взагалі відправити лише свої роботи. Виставка може відбутися і без фізичної присутності художника там"", – пояснює митець.  Facebook / Dema-Pisna Odarka Як повідомляв сайт vikka.ua, черкаський пенсіонер перетворив сільське подвір’я на арт-галерею.","#Виставка, #Вікка, #Новини, #Мистецтво, #Черкащанка, #Художниця",https://www.vikka.ua/novini/cherkaska-xudozhnicya-samouchka-zdivuvala-gruzinskogo-patriarxa-ta-znajshla-viznannya-v-yevropi/
Черкащани обурюються через освітлення вулиць удень (ФОТО)," 29 листопада черкащанин анонімно виклав до спільноти ""НеТипові Черкаси"" у Facebook фото, на яких видно ряд включених вдень ліхтарів по вулиці Надпільна. Чоловік обурюється і говорить, що як платник податків, не хоче оплачувати чиїсь помилки. Він вимагає звільнення безвідповідального ліхтарника. ""Якийсь ""валянок"" забув вимкнути світло. Я і інші черкащани маємо як платники податків оплачувати світло вдень, – пише він. – За таке потрібно звільнити. Ви уявляєте, скільки може коштувати освітлення вулиці за годину?"" Читайте: Біля залізничного вокзалу в Черкасах з’явиться нічне вуличне освітлення (ФОТО) Випадок скарг жителів Черкас на те, що вдень горять ліхтарі зовнішнього освітлення, не поодинокий, та чиновники кажуть, що це – норма.  У коментарі кореспонденту vikka.ua директор КП ""Міськсвітло"" Віталій Тєрьохін розповів, що кожного дня на диспетчерську службу 15-05 надходять заяви від жителів про ділянки, де перегорають ліхтарі, тому дивуватися денному освітленню – не варто. ""Щодня в нас працюють автовишки з поточного ремонту вуличного освітлення. Після того,як замінили лампу, перевіряють чи працює вона чи ні, тому вмикають освітлення. У нас щодня працює 3-4 автовишки в різних районах міста, – пояснив він. – Раніше щоразу включалося від 150 до 250 ліхтарів одночасно, а зараз, після того, як провели у 2014 році реконструкцію пульта керування зовнішнім освітленням, включають від 25 до 40"". Як повідомляв сайт vikka.ua, черкащани просять виділити з місцевого бюджету кошти на ліхтарі.","#Черкаси, #Вікка, #Новини, #Освітлення",https://www.vikka.ua/novini/cherkashhani-oburyuyutsya-cherez-osvitlennya-vulic-uden-foto/
У Черкасах розвінчають міфи про ВІЛ і вшанують пам’ять померлих від СНІДу (ВІДЕО)," 1 грудня відзначають Всесвітній день боротьби зі СНІДом та толерантного ставлення до людей, що живуть із ВІЛ. Саме тому цього дня у Черкасах благодійна організація ""Від серця до серця"" влаштовує акцію, щоб поширити інформацію про ВІЛ і згадати тих, хто помер від СНІДу. Про це БО повідомляє у Facebook. Читайте: Уманчани збирають подарунки для вихованців спеціальної школи-інтернату (ФОТО) 1 грудня о 12 годині до парку Сосновий бір благодійники відкриють меморіал, стрічку пам’яті людей, які померли від СНІДу. О 17.00 вони запрошують черкащан взяти участь у вікторині і пройти безкоштовне тестування на ВІЛ.  Як повідомляв сайт vikka.ua, на черкаському аукціоні для порятунку маленької Діани зібрали майже 200 тисяч гривень.","#Черкаси, #Вікка, #Новини, #Віл-інфіковані",https://www.vikka.ua/novini/u-cherkasax-rozvinchayut-mifi-pro-vil-i-vshanuyut-pamyat-pomerlix-vid-snidu-video/
У районах Черкащини запроваджують соціальне таксі," У чотирьох районах Черкащини запроваджують соціальне таксі. Дорослі і діти з особливими потребами зможуть безкоштовно користуватися спеціальним транспортом. Про це повідомляє ""Українське радіо"". Читайте: Уманчани збирають подарунки для вихованців спеціальної школи-інтернату (ФОТО) За словами начальника Департаменту соціального захисту населення Черкаської облдержадміністрації Руслана Чикала, благодійники передали соціальним установам області чотири нові мікроавтобуси, переобладнані для інвалідів. В автівках встановлені підіймальні платформи для візків. Вартість такої ініціативи становить майже 5 мільйонів гривень. Соціальне таксі передали у міста Умань, Звенигородка, Золотоноша та смт Чорнобай. За умови співфінансування влади і благодійників, наступного року ще 4 райони області отримають мікроавтобуси для таких перевезень. Як повідомляв сайт vikka.ua, у Черкасах розвінчають міфи про ВІЛ і вшанують пам’ять загиблих від СНІДу.","#Вікка, #Новини, #Черкащина, #Благодійність",https://www.vikka.ua/novini/u-rajonax-cherkashhini-zaprovadzhuyut-socialne-taksi/
Підприємство на Черкащині постачало в Росію товари подвійного та військового призначення (ФОТО)," На Черкащині співробітники Служби безпеки України блокували постачання до Російської Федерації товарів подвійного та військового призначення українського виробництва. Про це повідомляє прес-служба СБУ.  ДИВІТЬСЯ: Працівники ФСБ погрозами змушували черкащанина шпигувати в Україні (ВІДЕО) Правоохоронці встановили, що в умовах запроваджених Україною санкцій керівництво одного з підприємств Черкащини організувало механізм нелегальних поставок високотехнологічного військового обладнання до країни-агресора. Співробітники СБУ з’ясували, що підприємство, яке виготовляє навігаційні прилади з програмним забезпеченням для потреб української армії, постачає аналогічну продукцію до Росії. Обладнання зловмисники відправляли через так званий ""сірий канал"", тобто транзитом через країни Європи та Азії, щоб приховати реального отримувача товару.  Під час обшуків на підприємстві правоохоронці вилучили документацію, яка підтверджує незаконне відправлення продукції до РФ, та зразки обладнання подвійного призначення, яке направлено на експертизу. Відкрито кримінальне провадження за ч. 1 ст. 333 Кримінального кодексу України. Наразі тривають слідчо-оперативні дії.  Як повідомляв сайт vikka.ua, черкащанин і його спільники пропагували Росію в соцмережі.","#Вікка, #Новини, #Черкащина, #Сепаратизм, #Зрада",https://www.vikka.ua/novini/pidpriyemstvo-na-cherkashhini-postachalo-v-rosiyu-tovari-podvijnogo-ta-vijskovogo-priznachennya-foto/
Голову Соснівського райсуду Черкас звільнили з посади," Вища рада правосуддя звільнила голову Соснівського районного суду Черкас Володимира Васильовича Орленка із посади судді за скоєння дисциплінарного проступку. Про це йдеться на сайті ВРП. 31 травня 2017 року Третя Дисциплінарна палата Вищої ради правосуддя ухвалила рішення про притягнення судді до дисциплінарної відповідальності та застосування до нього дисциплінарного стягнення у виді подання про звільнення з посади судді. Читайте: Черкаський адвокат став суддею Верховного суду України У зазначених заявах скаржники вказували, що суддя Соснівського районного суду міста Черкас Орленко В.В. приймав рішення про обрання запобіжного заходу у вигляді тримання під вартою щодо осіб – учасників масових акцій протесту в період з 21 листопада 2013 року до набрання чинності Законом України від 8 квітня 2014 року № 1188-VII ""Про відновлення довіри до судової влади в Україні"" у зв’язку з їхньою участю у таких акціях. У своєму рішенні Третя Дисциплінарна палата Вищої ради правосуддя дійшла висновку, що виявлені в ході дисциплінарного провадження відомості вказують на факти вчинення суддею Орленком В.В. істотного дисциплінарного проступку, несумісного зі статусом судді, що є підставою для звільнення його з посади. Як повідомляв сайт vikka.ua, суддю із Черкащини підозрюють у застосуванні запобіжних заходів щодо учасників мирних акцій протесту.","#Вікка, #Новини, #Черкащина, #Суддя",https://www.vikka.ua/novini/golovu-sosnivskogo-rajsudu-cherkas-zvilnili-z-posadi/
Контакт. Анатолій Гриценко,,,https://www.vikka.ua/pryami-efiri/kontakt/kontakt-anatolij-gricenko-4/
Черкасці просять перевірити якість утеплення шкіл та дитячих садків," На сайті Черкаської міської раби з’явилася електронна петиція з проханням провести комплексну перевірку якості утеплення дитячих садочків на шкіл. Читайте: Шість способів, як черкащани можуть збільшити енергоефективність свого житла  ""Прошу створити комісію з фахівців по енергоефективності та провести експертизу якості виконання робіт з утеплення шкільних та дошкільних навчальних закладів підрядниками. Ініціюю проведення робіт тим, що під час власного обстеження утепленої частини стіни, було виявлено порушення виконання робіт, що свідчить про повну невідповідність нормативам"", − зазначив автор петиції Максим Кохась. Черкащанин зауважив, що порушення техніки виконання робіт по утепленню з матеріалів, які обрав проектант, можуть нашкодити здоров’ю дітей. Як повідомляв сайт vikka.ua, черкаський депутат прозвітував за проведену роботу з утеплення дитячого садка.","#Черкаси, #Вікка, #Новини, #Утеплення, #Петиція",https://www.vikka.ua/novini/cherkasci-prosyat-pereviriti-yakist-uteplennya-shkil-ta-dityachix-sadkiv/
Студенти черкаських вишів відіграли колективний шаховий онлайн-турнір (ВІДЕО),"Два черкаські виші влаштували колективний шаховий інтернет-турнір. Грали між собою Черкаський національний та технологічний університети. Разом зареєструвалося понад сотня студентів. Відіграли на спеціальній платформі, яку розробили програмісти. Усе – аби в одній грі одночасно могли взяти участь всі студенти. Напруга трималася майже весь турнір, адже грали ""на рівних"". Та все ж стратегічну перемогу здобули представники ЧНУ. Десять найбільш активних гравців, яких визначила сама ж програма, нагородили обідами в місцевих кав’ярнях. За мету такого ноу-хау – популяризація шахових змагань.","#Шахи, #Чну, #Змагання, #Турнір, #Чдту, #Університети",https://www.vikka.ua/novini-na-vikka/vikka-novini/studenti-cherkaskix-vishiv-vidigrali-kolektivnij-shaxovij-onlajn-turnir-video/
"Арт-четвер. Гурт ""Noitamriffa""",,,https://www.vikka.ua/pryami-efiri/art-chetver/art-chetver-gurt-noitamriffa/
