title,text,tegs,url
У Черкасах відбудеться ярмарок вакансій для людей з інвалідністю," З нагоди Міжнародного дня інвалідів 1 грудня о 13.00 в приміщенні Черкаського міського центру зайнятості відбудеться ярмарок вакансій. Про це повідомляють на сайті мерії. Безробітні та люди з інвалідністю, які нині перебувають у пошуках роботи, матимуть змогу зустрітися з представниками черкаських підприємств. Читайте: Громадські організації з усієї України ""ГРАНТували зміни"" у Черкасах (ФОТО) Ярмарок відбуватиметься за участю представників соціальних партнерів: Черкаської міської організації всеукраїнської організації інвалідів ""Союз організацій інвалідів України"", Черкаського обласного відділення Фонду соціального захисту інвалідів, обласного комунального закладу ""Черкаський обласний центр медико-соціальної експертизи"", департаменту соціальної політики Черкаської міської ради, організація ""Спілка батьків молоді з інвалідністю ""Перспектива"". Під час проведення заходу надаватимуться кваліфіковані консультації. За довідками звертатися до Черкаського міського центру зайнятості за адресою: м. Черкаси, вул. Гоголя, 330, тел. 37-51-58. Як повідомляв сайт vikka.ua, у Черкасах виділять 100 тисяч на новорічні подарунки дітям.","#Черкаси, #Вікка, #Новини, #Працевлаштування, #Інвалідність",https://www.vikka.ua/novini/u-cherkasax-vidbudetsya-yarmarok-vakansij-dlya-lyudej-z-invalidnistyu/
У лісництві на Черкащині оновили пункт для відпочинку (ФОТО)," Лисянські лісівники створили цього року три нових зони відпочинку, а також оновили найперший рекреаційний пункт на території Лисянського лісгоспу та однин із найдавніших в області – ""Холодок"". Про це повідомляє прес-служба Черкаського обласного управління лісового та мисливського господарства.  Читайте: У лісництвах Черкащини встановили нові вказівні знаки (ФОТО) Лісівники зробили реконструкцію трьох альтанок, кожна вміщує десять осіб. Для наймолодших відвідувачів встановили новеньку гойдалку. Усю територію відпочинку огородили парканом. Облаштували місце для вогнища та для сміття. Окрім того, оновили наглядну агітацію, де зазначають, що усе це робиться виключно для блага відпочиваючих.   Як повідомляв сайт vikka.ua, у лісництві на Черкащині зростає майже два мільйони сіянців сосни.","#Вікка, #Новини, #Черкащина, #Лісівники",https://www.vikka.ua/novini/u-lisnictvi-na-cherkashhini-onovili-punkt-dlya-vidpochinku-foto/
У Черкасах комунальникам дадуть десять тисяч літрів пального на зимове прибирання вулиць," КП ""ЧЕЛУАШ"" нададуть дозвіл на отримання десяти тисяч літрів дизельного пального для техніки під час зимового прибирання вулиць. Наразі паливо знаходиться у матеріальному резерві міста. Про це повідомляє прес-служба Черкаської міськради. Читайте: У дорожній пастці: ожеледиця паралізувала рух транспорту на Черкащині (ФОТО) З відповідним проханням до міської влади напередодні звернувся директор підприємства Олексій Мельник. У своєму листі він зазначив, що в КП ""ЧЕЛУАШ"" відсутні паливо-мастильні матеріали, що призводить до невиконання робіт з утримання доріг міста. Пальне очікується лише наприкінці 2017 року. Виконавчий комітет ухвалив рішення надати пальне у розмірі десяти літрів підприємству для безперебійної роботи з прибирання вулиць від опадів. Проте комунальники мають до 31 грудня цього року повернути зазначений обсяг пального до місцевого резерву. Як повідомляв сайт vikka.ua, меру Черкас заборонили купувати послуги з благоустрою.","#Черкаси, #Вікка, #Новини, #Зима, #Прибирання, #Челуаш",https://www.vikka.ua/novini/u-cherkasax-komunalnikam-dadut-desyat-tisyach-litriv-palnogo-na-zimove-pribirannya-vulic/
Житель Черкас виготовляв удома наркотики," Мешканці однієї з багатоповерхівок у Черкасах повідомили поліцейських про чоловіка, який виготовляє наркотики у своїй квартирі. Правоохоронці відразу приїхали на місце виклику і підтвердити підозри громадян. Про це повідомляє прес-служба ГУ НП у Черкаській області. Читайте: У Черкасах судитимуть двох чоловіків, які продавали психотропи та наркотики  40-річний місцевий житель вже притягувався до кримінальної відповідальності за зберігання та вживання наркотичних речовин. На кухні у його квартирі поліцейські знайшли близько 1 літру екстракту макової соломки у пластиковій пляшці. Чоловік зізнався рідина залишилась після виготовлення ним опію ацитильованого, який виготовив для власного вжитку. Правопорушнику загрожує покарання у вигляді штрафу від п'ятдесяти до ста неоподатковуваних мінімумів доходів громадян, або виправних робіт на строк до двох років, або арешту на строк до шести місяців, або обмеження волі на строк до трьох років, або позбавлення волі на той самий строк. Як повідомляв сайт vikka.ua, на Черкащині затримали молдаванина з наркотиками.","#Черкаси, #Вікка, #Новини, #Наркотики",https://www.vikka.ua/novini/zhitel-cherkas-vigotovlyav-udoma-narkotiki/
Суддю із Черкащини підозрюють у застосуванні запобіжних заходів щодо учасників мирних акцій протесту," Генпрокуратура повідомила про підозру судді одного з міськрайонних судів Черкаської області, який застосував запобіжні заходи щодо учасників мирних акцій протесту. Про це повідомляє прес-служба Генеральної прокуратури України. Департаментом спеціальних розслідувань Генеральної прокуратури України продовжується системна робота з розслідування, розкриття злочинів, вчинених під час акцій протесту у 2013-2014 роках, всебічне, повне і неупереджене дослідження обставин для забезпечення встановлення об’єктивної істини у кримінальних провадженнях цієї категорії та притягнення винних до відповідальності. Зокрема, здійснюється досудове розслідування у кримінальному провадженні за фактами протидії протестним акціям шляхом протиправного переслідування учасників мітингів та зборів у м. Черкасах в січні 2014 року працівниками правоохоронних органів та суду. Читайте: Черкаський адвокат став суддею Верховного суду України У цьому кримінальному провадженні перевіряється законність затримання, притягнення до кримінальної відповідальності та застосування запобіжних заходів щодо 66 осіб у період 23 – 27 січня 2014 року. На підставі зібраних доказів у межах цього кримінального провадження 28 листопада повідомлено про підозру судді одного з міськрайонних судів Черкаської області у вчиненні злочинів, передбачених ч. 2 ст. 28, ст. 340 (незаконне перешкоджання проведенню зборів, мітингів, вуличних походів і демонстрацій, здійснене за попередньою змовою групою осіб), ч. 2 ст. 375 (постановлення суддею завідомо неправосудних ухвал, що спричинило тяжкі наслідки). Підозрюваному інкримінується вчинення вищевказаних протиправних дій щодо 7 незаконно затриманих та арештованих осіб. На теперішній час зазначений суддя займає посаду голови міськрайонного суду Черкаської області. Досудове розслідування триває. Збираються та перевіряються на предмет допустимості та достатності для притягнення до кримінальної відповідальності докази щодо інших співучасників вчинення цих злочинів (працівників органів внутрішніх справ, прокуратури та суддів), а також за іншими епізодами злочинної діяльності. Як повідомляв сайт vikka.ua, на Черкащині судять кіровоградського суддю за вирок автомайданівцю.","#Вікка, #Новини, #Черкащина, #Суддя",https://www.vikka.ua/novini/suddyu-iz-cherkashhini-pidozryuyut-u-zastosuvanni-zapobizhnix-zaxodiv-shhodo-uchasnikiv-mirnix-akcij-protestu/
Черкаській музичній школі повернули приміщення вартістю майже 900 тисяч гривень," Дитячій музичній школі Черкаської міської ради повернули нежитлове приміщення площею 116,2 кв.м. та вартістю майже 900 тис. грн. Про це повідомляє заступник керівника Черкаської місцевої прокуратури Євгеній Троцько. Читайте: На Черкащині державі повернули землі пасовищ вартістю 900 тисяч  До суду було подано справу про розірвання договору позички між дитячою музичною школою №5 Черкаської міської ради та однієї з громадських організацій міста Черкаси. Під час судового розслідування відповідач повернув вказане нерухоме майно навчальному закладу для використання його за цільовим призначенням. Враховуючи добровільне виконання вимог прокурора, Черкаською місцевою прокуратурою подано до суду клопотання про припинення провадження у справі, в зв’язку з відсутністю предмету спору. Провадження у справі було припинено. Як повідомляв сайт vikka.ua, уЧеркасах державі повернуть земельну ділянку вартістю понад два мільйони.","#Черкаси, #Вікка, #Новини, #Суд",https://www.vikka.ua/novini/cherkaskij-muzichnij-shkoli-povernuli-primishhennya-vartistyu-majzhe-900-tisyach-griven/
"Синоптики розповіли, яким буде грудень на Черкащині"," Зазвичай погоду в грудні погода формується під впливом Сибірського антициклону та атлантичних циклонів. Тому характеризується снігопадами, хуртовинами, ожеледицею та налипання мокрого снігу. Про це на сторінці у Facebook повідомила прес-служба Черкаського гідрометцентру. Читайте: У дорожній пастці: ожеледиця паралізувала рух транспорту на Черкащині (ФОТО) За прогнозом синоптиків, грудень очікується в межах середніх показників температури і опадів, характерних для останніх 30 років. Середньомісячна температура повітря прогнозується -1,2° (за норми -2,4°), кількість опадів – 38 мм (за норми 48 мм). Морози до -10…-15º можливі наприкінці першої декади та наприкінці місяця. Всередині грудня очікується відлига та температура до +5…+7º. Найбільше опадів випаде всередині місяця у вигляді мокрого снігу та дощу, в решту часу переважатиме невеликий сніг. Сніговий покрив, висотою 1-3 см, спостерігатиметься у першій та третій декадах грудня. Опади у різних фазах у періоди відлиг сприятимуть утворенню ожеледі та ожеледиці на дорогах. Як повідомляв сайт vikka.ua, у Черкасах комунальникам дадуть десять тисяч літрів пального на зимове прибирання вулиць.","#Вікка, #Новини, #Черкащина, #Погода, #Зима",https://www.vikka.ua/novini/sinoptiki-rozpovili-yakim-bude-gruden-na-cherkashhini/
