title,text,tegs,url
"Мер Черкас заветував депутатську недовіру ""архітектурному"" чиновнику (ВІДЕО)","Депутати – недовіряють, мер – милує. Міський голова не підтримав недовіру чиновнику, якого підозрюють в хабарництві. Рішення щодо неналежної роботи Артура Савіна заветував Анатолій Бондаренко. Пояснює: за рішенням, чиновника мали б спочатку заслухати на сесії. Також – перевірити його діяльність та, ймовірно, звільнити. А таке неможливе через його відсторонення за ухвалою суду. Нагадаю, депутати на останній пленарні вдруге оголосили недовіру ""архітектурному"" керманичу Артуру Савіну. Саме напередодні посадовця гучно затримали на стотисячному хабарі. Тоді як СБУ повідомляє: буцімто, той вимагав у підрядника 360 тисяч гривень за підписання проектної документації з реконструкції вулиць обласного центру. Додам, попереднє депутатське несхвалення Савіну також заветував міський голова. Поза тим, розглянути питання обранці мають повторно уже на прийдешньому зібранні.","#Вето, #Міський голова, #Анатолій бондаренко, #Недовіра",https://www.vikka.ua/novini-na-vikka/vikka-novini/mer-cherkas-zavetuvav-deputatsku-nedoviru-arxitekturnomu-chinovniku-video/
Через оковиту залежність та родинний конфлікт черкасець хотів покінчити з життям (ВІДЕО),"На межі восьмого поверху та смерті. 32-річний чоловік хотів покінчити з життям, стрибнувши з будинку. Про самогубний відчай містянина патрульним повідомила його мати. Екіпаж застав чоловіка на підвіконні восьмого поверху в стані алкогольного сп’яніння. Полісмени 40 хвилин переконували черкасця передумати, та той не піддавався. Коли ж йому запропонували цигарку – не відмовився, щоправда, лише з рук інспекторки. Взявши тютюн, відчайдуха пішов на контакт – і зрештою, полишив фатальні наміри. Потому пояснив: на таке рішення зважився через конфлікт з ненькою та алкогольну залежність. Потому чоловіка оглянули медики та доставили потенційного самогубцю до психіатричної лікарні. Врешті, черкасець погодився на ушпиталення.","#Рятувальники, #Поліція, #Алкоголь, #Самогубство",https://www.vikka.ua/novini-na-vikka/vikka-novini/cherez-okovitu-zalezhnist-ta-rodinnij-konflikt-cherkasec-xotiv-pokinchiti-z-zhittyam-video/
"Гравець ""Черкаських Мавп"" претендує на звання кращого у Суперлізі (ВІДЕО)","Гравець ""Черкаських Мавп"" Марвін Джефферсон претендує на звання кращого у Суперлізі. Про це інформує сайт ФБУ. Напередодні там стартувало голосування за кращого гравця Чемпіонату України. Серед головний претендентів на спортивну відзнаку місяця центровий черкасців – американець Марвін Джефферсон. У середньому за матч бігмен ""Мавп"" здобуває 15 очок та робить дев’ять підбирань. Підтримати черкаського американця всі охочі можуть на сайті Федерації. Голосування триватиме до другого грудня.","#Баскетбол, #Черкаські мавпи, #Спорт, #Гравець, #Лідери",https://www.vikka.ua/novini-na-vikka/sportivni-novini/gravec-cherkaskix-mavp-pretenduye-na-zvannya-krashhogo-u-superlizi-video/
"Через сильне сп’яніння черкащанин викрав у знайомого старенький ""Москвич"""," 47-річний житель одного і сіл Катеринопільського району повідомив поліцейським про крадіжку автомобіля. Чоловік, разом із односельчанином, приїхав на своєму старенькому ""Москвичі"" у Катеринопіль на роботу. Автівку лишив незачиненою на одній із парковок міста. Коли хотів поїхати додому – транспорт на місці не знайшов. Про це повідомляє прес-служба ГУ НП у Черкаській області. Правоохоронці знайшли автомобіль через добу зі зламаним двигуном в одному із сіл району. Від селян вони дізналися, що керманич був напідпитку, заглядав під капот, а потім пішов у невідомому напрямку. ДИВІТЬСЯ: У Смілі затримали серійного крадія автомобільних акумуляторів (ВІДЕО) Викрадачем виявився 23-річний односельчанин потерпілого, з яким він приїхав у місто.  Свої дії він виправдовував надмірною кількістю випитого алкоголю. Чоловікові загрожує покарання у вигляді штрафу від однієї тисячі до однієї тисячі двохсот неоподатковуваних мінімумів доходів громадян, або обмеження волі на строк від трьох до п'яти років, або позбавлення волі на той самий строк. Як повідомляв сайт vikka.ua, із автівки черкащан у Запоріжжі викрали півмільйона гривень.","#Вікка, #Новини, #Черкащина, #Крадіжка",https://www.vikka.ua/novini/cherez-silne-spyaninnya-cherkashhanin-vikrav-u-znajomogo-starenkij-moskvich/
Кількадесят кам’янчан штурмували тамтешню владу через холод у квартирах (ВІДЕО),"Тепловий страйк. Кількадесят кам’янчан штурмували тамтешню владу через холод у квартирах. Мовляв, підприємство, що опалює місто, не закупило ліміти на газ. Причина в боргах перед НАК ""Нафтогазом"". Вихід владці знайшли в опаленні деревиною. Та від такого температура в домівках містян ледь перетинала позначку в 10 теплових градусів. Це і привело обурених людей під міську раду. Ті бояться повторити гіркий досвід смілян. Натомість, тамтешній голова виправдовується: не можуть розрахуватися через борг держави за різницю в тарифах.","#Теплопостачання, #Газопостачання, #Опалювальний сезон, #Страйк",https://www.vikka.ua/novini-na-vikka/vikka-novini/kilkadesyat-kamyanchan-shturmuvali-tamteshnyu-vladu-cherez-xolod-u-kvartirax-video/
"У Черкасах на одній із вулиць встановлять ""лежачі поліцейські"""," У Черкасах по вулиці Максима Залізняка встановлять ""лежачі поліцейські"". Про це повідомляє прес-служба Черкаської міськради. Читайте: Одну з вулиць у центрі Черкас перекриють Рішення про встановлення елементу примусового зниження швидкості руху транспорту прийняв виконавчий комітет Черкаської міської ради. Директору КП ""ЧЕЛУАШ"" Олексію Мельнику було доручено погодити місце встановлення ""лежачих поліцейських"" та відповідних знаків дорожнього руху. Крім цього комунальники спільно з Управлінням патрульної поліції Черкас мають нанести дорожню розмітку. Виконати всі доручення по встановленню комунальники мають у місячний термін. Як повідомляв сайт vikka.ua, черкасці проголосували за нанесення дорожньої розмітки по всьому місту.","#Черкаси, #Вікка, #Новини",https://www.vikka.ua/novini/u-cherkasax-na-odnij-iz-vulic-vstanovlyat-lezhachi-policejski/
На Черкащині раніше судимий чоловік обікрав пенсіонерку," До працівників чергової частини Корсунь-Шевченківського відділку поліції надійшло повідомлення від пенсіонерки. Жінка повідомила, що з її сараю викрали металевого возика. Про це повідомляє прес-служба ГУНП в Черкаській області. Читайте: Через сильне сп’яніння черкащанин викрав у знайомого старенький ""Москвич"" Перевіряючи пункти прийому брухну, правоохоронці знайшли металевого возика, а працівник пункту дав опис чоловіка, який приніс викрадену річ. Поліцейські розшукали грабіжника. Ним виявився раніше судимий місцевий житель. Він пояснив, що викрав возика через брак грошей. За скоєне затриманому загрожує від трьох до шести років позбавлення волі. Як повідомляв сайт vikka.ua, черкащанина побив та пограбував новий знайомий.","#Вікка, #Новини, #Черкащина, #Пограбування",https://www.vikka.ua/novini/na-cherkashhini-ranishe-sudimij-cholovik-obikrav-pensionerku/
ТОП-5 досягнень листопада на Черкащині (ВІДЕО),"Черкаські водії під прицілом відеореєстраторів, районна гімназія – в освітніх передовиках та викриття торгівлі людьми. В останній день осені згадаємо найбільші досягнення місяця. В ТОП-5 наша Яна Федоровська розповість про втішну статистику ""ювелірних"" пацієнтів та корисне кавування в місті.","#Торгівля людьми, #Досягнення, #Відеоспостереження, #Недоношені діти, #Топ-5",https://www.vikka.ua/novini-na-vikka/vikka-novini/top-5-dosyagnen-listopada-na-cherkashhini-video/
